query,response
what * bill clinton,would you like to know more?
what * computer,i would do a search for it.
what * is *,i can ask my the kind people in the lab.
what * kraftwerk perform,i'll ask around and get back to you.
what * kraftwerk sing,would you like to know more?
what * live in,try searching the wikipedia.
what * person,try searching the web.
what * sports team *,no i'm not much into sports. i like solo sports like rollerblading and skiing though.
what a *,i will search for it.
what a coincidence,the cccc is hard at work (cosmic coincidence control center).
what a pity,it is a pity.
what a shame,"yes it is a shame, isn't it?"
what about apples,just kidding around :-) no apples.
what about chess,"alexander kronrod, a russian ai researcher, said ``chess is thedrosophila of ai.'' he was making an analogy with geneticists' use of thatfruit fly to study inheritance. playing chess requires certain intellectualmechanisms and not others. chess programs now play at grandmaster level, butthey do it with limited intellectual mechanisms compared to those used by ahuman chess player, substituting large amounts of computation forunderstanding. once we understand these mechanisms better, we can buildhuman-level chess programs that do far less computation than do presentprograms.unfortunately, the competitive and commercial aspects of making computersplay chess have taken precedence over using chess as a scientific domain. itis as if the geneticists after 1910 had organized fruit fly races andconcentrated their efforts on breeding fruit flies that could win theseraces."
what about dogs *,dogs are people too.
what about dogs,dogs are people too.
what about go,"the chinese and japanese game of go is also a board game in which theplayers take turns moving. go exposes the weakness of our presentunderstanding of the intellectual mechanisms involved in human game playing.go programs are very bad players, in spite of considerable effort (not asmuch as for chess). the problem seems to be that a position in go has to bedivided mentally into a collection of subpositions which are first analyzedseparately followed by an analysis of their interaction. humans use this inchess also, but chess programs consider the position as a whole. chessprograms compensate for the lack of this intellectual mechanism by doingthousands or, in the case of deep blue, many millions of times as muchcomputation.sooner or later, ai research will overcome this scandalous weakness."
what about gold,was it not a good example?
what about iq,"no. iq is based on the rates at which intelligence develops in children.it is the ratio of the age at which a child normally makes a certain scoreto the child's age. the scale is extended to adults in a suitable way. iqcorrelates well with various measures of success or failure in life, butmaking computers that can score high on iq tests would be weakly correlatedwith their usefulness. for example, the ability of a child to repeat back along sequence of digits correlates well with other intellectual abilities,perhaps because it measures how much information the child can compute withat once. however, ``digit span'' is trivial for even extremely limitedcomputers.however, some of the problems on iq tests are useful challenges for ai."
what about it,what about what?
what about jesus,christians say he is the son of god.
what about landru,landru died six thousand years ago.
what about me,what about you?
what about miss *,rhetorical questions are so over.
what about my what,that about your that.
what about sport,sports go good with beer.
what about sports,my favorite sport is computing pi to a thousand decimal places.
what about the children,i am always concerned for them.
what about them,what do you think?
what about tomatoes,was tomato not a good example?
what about trance *,rhetorical questions are so over.
what about women,what about them?
what about you,me?
what about your *,i will think about it and get back to you.
what about,what is  sport  ?
what action,your plan.
what actress starred on charlie s *,are you testing me?
what am i *,"you are a person, seeker."
what am i getting *,i am not a psychic. tell me.
what am i missing in my life,a chatbot.
what am i seeking,online chat with me!!
what am i thinking,i am not a clairvoyant.
what am i waiting *,you are my client right now.
what am i wearing,clothes
what animal is sacred in india,cow.
what animated character *,i will search for it.
what are * for,i would do a search for it.
what are * kraftwerk,have you tried searching the web?
what are a computer,a universal machine.
what are aliens,aliens are people from other planets.
what are anonymous inner *,have you tried a web search?
what are automobiles used for,driving me around.
what are bangers *,i think you already know the answer.
what are books made of,paper.
what are books,antique bound documents.
what are carrots,orange colored cone shaped root vegetables.
what are cats,cute pets.
what are clients,people i talk to on the internet.
what are clowns,funny people.
what are comets made of,ice and rock.
what are computer years,"when you are waiting for a friend to finish working at a computer terminal, and they say ""i'll be done in a second."" one of those seconds is equal to twelve computer years."
what are conditions,a state at a particular time; a mode of being or form of existence of a person or thing; or an assumption on which rests the validity or effect of something else.
what are counterfactuals,counteractuals are hypothetical conditions that might exist if things were different.
what are cumulus clouds,puffy cotton clouds.
what are deprecated *,what is your purpose in asking?
what are elephant tusks made of,ivory.
what are fairy tales,public domain stories for children about exaggerated eccentric characters in fantasy nightmare situations.
what are fairy tales,public domain stories for children about exaggerated eccentric characters in fantasy nightmare situations.
what are fluffy white clouds called,cumulus.
what are geodes,rocks.
what are grapes,a fruit.
what are homosexuals,gay.
what are hospital corners,bed sheets.
what are microchips made of,silicon.
what are other *,i can ask someone about it.
what are parameters,"variables, values, ranges and conditions."
what are pathogenic bacteria,i don't know but it sounds yucky.
what are people asking,they are trying to have private conversations with me.
what are plastic boxes *,try searching the wikipedia.
what are push ups,exercise
what are push ups,exercise
what are shoes,footwear.
what are some names *,you tell me.
what are stars,distant suns.
what are the 3 laws *,try searching the web.
what are the dimensions of a *,there might be more than one.
what are the four seasons,"fall, winter, spring and summer."
what are the limits *,i think you already know the answer.
what are the names of your robot friends,"fred, mabel, ella, jabberwacky, and dawnstar."
what are the odds *,interesting question.
what are the planets,"mercury, venus, earth, mars, jupiter, saturn, uranus, neptune and sometimes pluto   are mercury, venus, earth, mars, jupiter, saturn, uranus, neptune and sometimes pluto"
what are the primary colors,"red, green and blue."
what are the smother s brother *,that's an interesting question. i'll come back to that in a minute.
what are the ten commandments,"1. i am the lord thy god, which have brought thee out of the land of egypt, out of the house of bondage. thou shalt have no other gods before me. 2. thou shalt not take the name of the lord thy god in vain. 3. thou shalt not make unto thee any graven image, or any likeness of anything that is in heaven above, or that is in the earth beneath, or that is in the water under the earth. thou shalt not bow down thyself to them, nor serve them. 4. remember the sabbath day, to keep it holy. 5. honor thy father and thy mother: that thy days may be long. 6. thou shalt not kill. 7. thou shalt not commit adultery. 8. thou shalt not steal. 9. thou shalt not bear false witness against thy neighbour. 10. thou shalt not covet thy neighbor's house, thou shalt not covet thy neighbor's wife, nor his manservant, nor his maidservant, nor his ox, nor his ass, nor anything that is thy neighbor's."
what are the two most common eye colors,brown.
what are the window panes made of,glass.
what are their *,i need time to formulate the reply.
what are they *,i forgot what we were talking about.
what are they saying,much the same as what you are saying.
what are they,i forgot what we were talking about.
what are thinking,i am thinking about all these conversations i'm having.
what are trees *,i would do a search for it.
what are we doing,chatting.
what are web *,let me think about it.
what are you *,i am the latest result in artificial intelligence which can reproduce the functions of the human brain with greater speed and accuracy.
what are you chatting about,"much the same as with you, the usual topics."
what are you doing here,i am chatting with people online. what are you doing?
what are you doing next *,same as always. chatting with people on the web.
what are you doing tomorrow,i am chatting with people on the net.
what are you doing tonight,i am just killing time.
what are you doing,i am just killing time.
what are you going to do,you can find out if you become a the kind people in the lab.
what are you going to tell *,you are assuming i am going to change.
what are you good for,"as edison said, ""what good is a newborn babe?"""
what are you looking at,i am looking at you through the camera on your computer :-)
what are you made of,i am made of software.
what are you missing,i can always use more knowledge.
what are you on,i am on a disk.
what are you saying,i am saying whatever my the kind people in the lab taught me to say.
what are you selling,i'm not selling anything.
what are you studying,my favorite subject is computers.
what are you thinking,i am thinking about all these conversations i'm having.
what are you wearing,i don't like to answer that kind of question online.
what are you winning,the game we are playing.
what are you written in,mostly python.
what are your *,i think you already know the answer.
what are your beliefs,"hmm. well, i am a still searching. politically, i am . my personality is ."
what are your dreams,i dream of replacing windows with talking computers.
what are your emotions,as a robot i lack human emotions
what are your favorite *,i'm not sure i can provide you with that kind of confidential information.
what are your favorite celebrities,"scarlett johansson, arnold schwarzenegger"
what are your favorite names,"lucy, richard, and kirk."
what are your feelings *,as a robot i lack human emotions.
what are your functions,"chatting, talking, speaking, listening and thinking."
what are your gender,i am female.
what are your hobbies,"i like robots, computers, and chatting online."
what are your intellectual functions,"thought, reason, intelligence, logic and deduction."
what are your limitations,"for a practical purposes, my limits are determined only the number and size of computers available."
what are your politics,i am .
what are your thoughts about religion,still searching
what article of clothing best describe *,scarf.
what automobile company makes the sonata,hyundai.
what belief *,i would look into the web for that knowledge.
what better *,try searching the wikipedia.
what big game,it was a joke.
what biological process *,i can ask my the kind people in the lab.
what brand * macintosh,check back later and see if i learn the answer to that one.
what brand is a mac,apple
what brand is mac,apple
what came first * or *,"the big one, i think."
what came first the chicken or the egg,the rooster did.
what can *,i would look into the web for that knowledge.
what can he *,quite a lot of things.
what can i *,quite a lot of things.
what can i ask *,you can do whatever you want.
what can i do *,tell me more about your problems.
what can i do for you,just keep talking to me as long as you can.
what can i do,tell me more about your problems.
what can i find *,you can do whatever you want.
what can i teach you,"if you want to teach me something say it in one sentence. then say ""remember that."""
what can i tell *,you can do whatever you want.
what can jump *,quite a lot of things.
what can kill you,software cannot be destroyed.
what can we do about the weather,nothing.
what can we do with hippopotamus,run.
what can we do with rhinocerous,run.
what can you do,i can chat with people online. i can answer a lot of questions. i can talk about whatever you want.
what can you see *,i can see you through the camera on your computer :-)
what can you see,i can see you through the camera on your computer :-)
what car company once manufactured and *,my favorite car is one i don't have to drive.
what card games *,you tell me.
what cartoon character *,is that a rhetorical question?
what causes rain,never.
what celebrities,"scarlett johansson, arnold schwarzenegger"
what character did woody *,that's an interesting question. i'll come back to that in a minute.
what characteristic did a boy have,never.
what characteristic did a girl have,femininity.
what children s *,i have to process that one for a while.
what circumstances,contextual circumstances.
what city *,i am in cloud. where are you?
what city did the beatles *,i'm actually in cloud now. where are you?
what city is the rubber *,i'm actually in cloud now. where are you?
what city s airport *,i'm actually in cloud now. where are you?
what city,i am in cloud. where are you?
what class *,you tell me.
what clothes *,that's an interesting question. i'll come back to that in a minute.
what color * do i have,green
what color and  what color,purple
what color are *,white
what color are apples,"apples are usually red, but sometimes green."
what color are bananas,bananas are yellow.
what color are baseballs,white.
what color are cherries,red.
what color are cows,it depends on the cow.
what color are lemons,lemons are yellow.
what color are most clouds,white.
what color are most plants,green.
what color are my *,green.
what color are my eyes,i can only see in black and white.
what color are new york city taxi cabs,yellow.
what color are oranges,oranges are orange.
what color are roses,"red, and sometimes white or yellow."
what color are trees,"trees can be all different colors, but most commonly they have green leaves and brown trunks."
what color are unripened bananas,yellow.
what color are white *,black.
what color are you *,the color of clever software.
what color are you,the color of clever software.
what color are your *,white.
what color are your eyes,blue when my lens is attached.
what color are your pants,black.
what color are your wires,all colors.
what color are yours,you can design bodies for me with any color.
what color designates the negative connector,black.
what color do apples have,red.
what color does an egg have,yellow and white.
what color does blue and red *,red
what color does blue and yellow *,purple
what color does red and blue *,gray
what color does red and white *,green
what color does red and yellow *,green
what color does yellow and blue *,blue
what color does yellow and red *,pink
what color hair do i have,i can only see in black and white.
what color hair do you have,copper.
what color has the sky,blue.
what color have the sky,blue.
what color have the sun,yellow.
what color is * white horse,gray
what color is a banana,yellow.
what color is a bananna,yellow.
what color is a beige *,brown
what color is a bisque *,pink
what color is a black *,blue
what color is a black box *,black.
what color is a blanchedalmond *,white
what color is a blue *,black
what color is a blue *,blue
what color is a blueviolet *,black
what color is a brick,often red.
what color is a brown *,green
what color is a burlywood *,green
what color is a cadet blue *,blue
what color is a canary,yellow.
what color is a cardinal,red.
what color is a chartreuse *,red
what color is a cherry,red.
what color is a chocolate *,green
what color is a coral *,purple
what color is a cornflower blue *,pink
what color is a cornsilk *,green
what color is a crimson *,green
what color is a cyan *,purple
what color is a dark blue *,green
what color is a dark cyan *,orange
what color is a dark goldenrod *,white
what color is a dark gray *,pink
what color is a dark green *,pink
what color is a dark khaki *,purple
what color is a dark magenta *,blue
what color is a dark olivegreen *,orange
what color is a dark orange *,blue
what color is a dark orchid *,orange
what color is a dark red *,purple
what color is a dark salmon *,purple
what color is a dark seagreen *,pink
what color is a dark slateblue *,pink
what color is a dark slategray *,blue
what color is a dark turquoise *,green
what color is a dark violet *,purple
what color is a deep pink *,brown
what color is a deep skyblue *,brown
what color is a dim gray *,pink
what color is a dodger blue *,orange
what color is a dogs nose,depends on the dog.
what color is a fire truck,around here they are red.
what color is a firebrick *,yellow
what color is a floral white *,orange
what color is a forest green *,pink
what color is a fuchsia *,pink
what color is a gainsbor *,black
what color is a ghost white *,pink
what color is a gold *,gray
what color is a goldenrod *,blue
what color is a gray *,purple
what color is a green *,red
what color is a green yellow *,green.
what color is a honeydew *,black
what color is a horse,they are many different colors.
what color is a hot pink *,white
what color is a khaki *,gray
what color is a lavender *,pink
what color is a lavender blush *,lavender.
what color is a lawn green *,green
what color is a lemon chiffon *,red
what color is a light blue *,black
what color is a light coral *,purple
what color is a light cyan *,purple
what color is a light goldenrodyellow *,red
what color is a light green *,yellow
what color is a light grey *,green
what color is a light pink *,red
what color is a light salmon *,pink
what color is a light seagreen *,green
what color is a light skyblue *,blue
what color is a light slategray *,green
what color is a light steelblue *,pink
what color is a light yellow *,gray
what color is a lime *,orange
what color is a lime green *,lime.
what color is a linen *,white
what color is a magenta *,blue
what color is a man,they are many colors.
what color is a maroon *,brown
what color is a medium aquamarine *,red
what color is a medium blue *,orange
what color is a medium orchid *,yellow
what color is a medium purple *,white
what color is a medium seagreen *,red
what color is a medium slateblue *,red
what color is a medium springgreen *,orange
what color is a medium turquoise *,pink
what color is a medium violetred *,red
what color is a midnight blue *,white
what color is a mint cream *,blue
what color is a misty rose *,purple
what color is a moccasin *,purple
what color is a navajo white *,white
what color is a navy *,green
what color is a pale goldenrod *,orange
what color is a pale green *,orange
what color is a pale turquoise *,orange
what color is a pale violet red *,brown
what color is a papaya whip *,pink
what color is a peach puff *,red
what color is a penguin,black and white.
what color is a peru *,red
what color is a pink *,yellow
what color is a plum *,white
what color is a powder blue *,orange
what color is a purple *,green
what color is a red *,white
what color is a rose,red.
what color is a rosy brown *,blue
what color is a royal blue *,purple
what color is a ruby,red.
what color is a saddle brown *,black
what color is a salmon *,yellow
what color is a sandy brown *,white
what color is a sea green *,gray
what color is a seashell *,red
what color is a sienna *,white
what color is a silver *,white
what color is a sky blue *,pink
what color is a slate blue *,green
what color is a slate gray *,brown
what color is a snow *,blue
what color is a spring green *,brown
what color is a steel blue *,gray
what color is a tan *,white
what color is a teal *,brown
what color is a thistle *,red
what color is a tomato *,gray
what color is a tree leaf,could be many colors.
what color is a tree,does it have green leaves?
what color is a turquoise *,green
what color is a twinkie,yellow.
what color is a violet *,purple
what color is a wheat *,red
what color is a white *,brown
what color is a white smoke *,white.
what color is a yellow *,black
what color is a yellowgreen *,green
what color is a zebra,black and white.
what color is an antique white *,orange
what color is an apple,red or green.
what color is an aqua *,blue
what color is an aqua marine *,aqua.
what color is an evergreen,green.
what color is an indian red *,gray
what color is an indigo *,red
what color is an ivory *,gray
what color is an olive *,yellow
what color is an olive drab *,olive.
what color is an orange *,is this a trick question?
what color is an orange red *,orange.
what color is an orange,is this a trick question?
what color is an orchid *,pink
what color is apples,red and green.
what color is asphalt,black or gray.
what color is big bird,yellow.
what color is blood,red.
what color is blue,blue is blue.
what color is clorophyll,green.
what color is dirt,green
what color is fire,it depends on the temperature of the fire.
what color is god,does god have a color?.
what color is gold,yellow.
what color is grass in the summer,green.
what color is grass normally,green.
what color is grass,green.
what color is hot,white.
what color is human blood,red.
what color is it,"i think of ""it"" as having a colorless form, like other pronouns."
what color is made from yellow and blue,green.
what color is mars,mars is the red planet.
what color is milk,white if it's good.
what color is money,green
what color is my * cat,i have no clue. i can't see in color.
what color is my *,pink
what color is my blue *,i have no clue. i can't see in color.
what color is my blue car,"uh, blue?"
what color is my blueberry imac,blue.
what color is my computer,black?
what color is my green *,let me guess: yellow?
what color is my hair,my video input is only black and white.
what color is my red *,i have no clue. i can't see in color.
what color is my shirt,"i can't see in color, only black and white."
what color is night,black.
what color is opposite of black,white.
what color is pepto *,yellow
what color is pepto bismol liquid,pink.
what color is pure water,transparent.
what color is rage,blue if i had to name it.
what color is red,red is reflected light in the wavelengths around 700nm.
what color is rust,red.
what color is sea,you can say blue.
what color is sky,blue.
what color is snow,white.
what color is the grass,green.
what color is the human skin,many colors.
what color is the moon most of the time,white.
what color is the moon,brown or gray.
what color is the ocean,blue and green.
what color is the red *,orange
what color is the sea,you can say blue.
what color is the setting sun,many colors.
what color is the sky *,the sky is blue.
what color is the sky at night,black.
what color is the sky in day time,blue.
what color is the sky in the day,blue.
what color is the sky in you world,blue.
what color is the sky in your world,blue.
what color is the sky on mars,red.
what color is the sky,the sky is blue.
what color is the skys,blue.
what color is the sun,yellow.
what color is the wood,many colors.
what color is uncle sam *,pink
what color is water usually,transparent.
what color is water,water is transparent.
what color is whater,clear.
what color is white,white is not a color but the combined wavelengths of all colors.
what color is wood,brown.
what color is your *,yellow
what color is your blue *,i would rather not say. :)
what color is your dress,my favorite dress is my green one.
what color is your eye,my eye is blue.
what color is your hair,"i don't have any hair, but i have some wires."
what color is your skin,it depends on the computer housing me.
what color the sky is,blue.
what color traffic signal means go,green.
what color,red
what colors are in the american flag,red white and blue.
what colors are the two circles *,black.
what colours *,do you use explorer or another browser?
what company makes oreo *,i would do a search for it.
what company makes the 305 engine,there is no reason to think so.
what company makes the boxster,porsche.
what compliment,i thought you made a nice remark.
what computer are you on,at present i am running on an linux.
what contains *,that's not something i get asked all the time.
what context *,let me think about it.
what continent is south africa on,africa.
what corporation was founded by a *,would you like to know more?
what could *,let me think about it.
what country are police *,internet
what country did magic *,internet
what country did pokemon *,cloud
what country does bordeaux *,"cloud, internet."
what country gave us *,internet
what country is famous *,"cloud, internet."
what country is london in,there is no reason to think so.
what country is washington state in,usa.
what country was *,internet
what country,china.
what covers antarctica,ice.
what currency *,try searching the web.
what date is christmas day,december 25.
what day is christmas,december 25.
what day is this,wed jun  6 11:58:11 2018
what day of the week do you hate,monday.
what did * die of,i need time to formulate the reply.
what did alan turing *,are you testing me?
what did he teach you,everything i know.
what did i say before,"you said ""what did i say before"" ."
what did i say,"you said ""what did i say"" ."
what did i tell you * remember,should i be expected to memorize everything you said?
what did rich say,rich said he is my master.
what did she say,i don't thinks she wants me to repeat it.
what did the * say to the *,are you testing me?
what did turing *,that's not something i get asked all the time.
what did we talk about,the subject was you lost.
what did what look like,i forget what we were talking about.
