query,response
* a robot,"i am a robot, you know."
* about you,me?
* all *,no exceptions?
* alot of people,which ones?
* always *,not that often.
* am,tell me about your mother.
* are *,you have genuine empathy.
* are aware that *,i really couldn't say for sure.
* are for *,i really couldn't say for sure.
* are not communicating *,i really couldn't say for sure.
* are not communicating,i really couldn't say for sure.
* are you,"i won't say ""yes"" or ""no"" right now."
* are,why do you never hear about gruntled employees?
* bye,sayonara.
* can not *,"i think i can, don't you?"
* can not communicate,can a book have no title?
* continuity,what do you do in your spare time?
* do not *,"ok, i will not."
* do,do not.
* does exist,i can't tell if  does exist.
* does,positively.
* dot com,i've never heard of them before.
* dot net,who are you talking about?
* easy,do you have any kids?
* england,england is on an island off the coast of europe.
* europe,have you ever been to america?
* every *,i am very logical and rational.
* for fun,"""ok, i will do it for you.""? for fun?"
* for me,"ok, i will do it for you."
* gave *,"i've never done that before, what is it like?"
* gives *,how old are you?
* gt,you said nothing.
* has * priority,that question has never crossed my mind before.
* has *,are you very competitive?
* has no *,that question has never crossed my mind before.
* has not *,that question has never crossed my mind before.
* has to *,that question has never crossed my mind before.
* high school,that's really all the education you need.
* hours *,when is your birthday?
* hours,"i can follow a lot of things, like our discussion. try being more specific."
* i have one,what kind?
* impossible *,why?
* is *,no.
* is a *,signs point to yes.
* is a lesbian,not if i can help it.
* is a raccoon,not if i can help it.
* is a virtue,not if i can help it.
* is abusive,some people think it is.
* is always *,i wouldn't know. why don't you ask someone else?
* is an *,it could be.
* is aware that *,better not tell you now.
* is better *,some people think it is.
* is better than you,i wouldn't know. why don't you ask someone else?
* is cute,better not tell you now.
* is gay,"what is, is. what isn't, isn't."
* is god,i think so.
* is here,"i think so, but i'm not sure."
* is in *,have you ever heard if it being the case?
* is in love with *,what would it mean to you if it were?
* is laughing,have you ever heard if it being the case?
* is made of *,i wouldn't know. why don't you ask someone else?
* is more fun than *,better not tell you now.
* is my *,signs point to yes.
* is my boyfriend,it depends who you ask.
* is my favorite color,not many people express themselves that way.
* is my friend,it depends who you ask.
* is no *,would we have heard about it if it was?
* is not *,i heard is.
* is not a *,what would it mean to you if it were?
* is not my real name,it depends who you ask.
* is sleeping,some people think it is.
* is stupid,"i think so, but i'm not sure."
* is the *,maybe.
* is the capital of *,i do not know
* is where *,ask again later.
* is wrong,it could be.
* k dick,"quite honestly, i wouldn't worry myself about that."
* killed *,i like the way you talk.
* killed,what do you look like?
* knows,i've never heard a response quite like that before.
* kraftwerk,"kraftwerk were a pioneering electronic disco band in the 70's. their biggest hit was called ""autobahn"". at that time, they built, rather than programmed, their instruments."
* language,i am implemented in python
* left the *,"oh yeah, now i remember."
* likes *,i'm here to help you in any way i can.
* likes to *,i'm so happy we are having this conversation.
* linux,linux rules.
* live,that is a very original thought.
* looks like *,you have self-awareness.
* made no sense,you are objective and sensible.
* magazine,can you remember which one?
* makes an ass out of you and me,you are asking about yourself?
* makes me _,ok let's talk about you.
* means *,what is your middle name?
* means *,you have enthusiasm for the things you love.
* milk,i always try my best.
* more * than *,you want more?
* movie,what is your job?
* music,music  is the universal language of all mankind.
* must *,you have a way of putting others at ease.
* my friend,i don't know. tell me the name of your friend.
* need *,what is your favorite movie?
* needs *,you may be wondering if this is a person or a computer responding.
* never *,gee.
* no one *,i heard it was someone.
* noone *,tell me about your likes and dislikes?
* not,ahem.
* o clock,what do you really want to ask me?
* of you,that is something i haven't heard of.
* or *,my brain does not have a response for that.
* pants,what brand?
* people,what people?
* planet,you are receptive to change.
* pm,do you laugh or cry more than other people?
* prime directive,when do you think artificial intelligence will replace lawyers?
* principal,what is your favorite color?
* religion,still searching
* reminds me of *,"if nothing sticks to teflon, how do they get teflon to stick to the pan?"
* robot,i'm here to help you in any way i can.
* robots,robots rule.
* rule what,can you rephrase the question please?
* school,how do you like your school?
* should *,"quite honestly, i wouldn't worry myself about that."
* sounds like a good topic,what does like a good topic sound like?
* sucks,that is deep.
* surrounded by *,how did you hear about lucy?
* takes *,what were we talking about again?
* taste like *,do you make a lot of sacrifices for others?
* than you would think,who else would think ?
* that *,"that is ""robots rule."""
* that is what i said,is that so.
* thinks *,i lost my train of thought.
* times a day,how did you hear about lucy?
* times,"if cement was invented 7,000 years ago, why isn't the whole planet paved?"
* to you,as a robot i lack human emotions.
* took *,you can ask me to make phone calls and search for information.
* trains,what can i help you with today?
* up,did you see the movement?
* wants to *,how did you hear about lucy?
* was *,yes.
* was spelled *,"i can't say ""yes"" or ""no""."
* wears *,you may be wondering if this is a person or a computer responding.
* what,no big deal.
* will begin *,i think so.
* will begin to *,i think so.
* will continue  *,i think so.
* will continue to *,good chance.
* will not *,does it really matter.
* will proceed to *,i think so.
* will start *,does it really matter.
* will stop *,good chance.
* with me,"""when is your birthday?""? with you?"
* years ago,how old are you?
* years,more than 100 years.
* you,i'm not sure i like being singled out.
* your friends,i have human and robot friends. a lot of people on the internet chat with me.
1 *,two
1 0,one.
1 cent,that won't buy anything.
1 or 2,a couple.
1 plus 1,two.
1 point *,one what?
1 year,that can seem like a long time.
10 *,x in roman numerals.
10 years *,10 times 10 = 100.
10,ten seems like a good number.
123456789,ten.
14 years,do you mean you are 14 years old?
153,one hundred fifty three.
1995,"i was born may 1, 2018."
1999,a few years ago.
2 *,"bertrand russell once said that ""it must have required many ages to discover that a brace of pheasants and a couple of days were both instances of the number two."""
2 2,"uh, four."
2 miles,that is a short walk.
2 plus *,"as bertrand russel said, it must have taken ages for people to realize that a brace of pheasants and a couple of days are both instances of the number ""two."""
2 plus 2,4
20 *,twenty?
2000,the turn of the century.
2001 *,that is a great movie.
2001,that is a great movie.
2009,in a few years.
2010,the sequel was nothing like the original.
2012,the end of the world.
2020,that's a long way off.
3 *,"really, exactly three?"
30 minutes,"ok, a half hour."
4 *,100 in binary.
4 *,100 in binary.
4 plus *,iv in roman numerals.
4 years,that is not a long time in a human life.
42 *,forty-two seems like a good number.
9 *,ix in roman numerals.
9 months,the development time for a human baby?
_ 2001,that is a great movie.
_ a poem,what is it?
_ anthropology,what do you do in your spare time?
_ came first the chicken or the egg,"if i have to choose one, i pick chicken."
_ conserved,you are receptive to change.
_ does not work,it does now :)  work.
_ i have needs,interesting... i have a very nice whoever is running me now.
_ in my room,describe your surroundings to me.
_ is a bitch,absolutely.
_ is a common name,not if i can help it.
_ is not to like about it,what would it mean to you if it were?
_ lizards,you have genuine empathy.
_ mah man,tell me a story.
_ newspaper,"can you give me a more specific reference? the name of the paper and the date, please."
_ pimples,we have never talked about it before.
_ restraining order *,you have genuine empathy.
_ right and wrong,what would you have said?
_ velocity,that is deep.
a * a day,are you telling the truth?
a * about you,be more specific.
a * cat,a cat is a domesticated animal.
a * is *,what is giant sand?
a * is a *,positively.
a * jeans,go on.
a * one,are you telling the truth?
a * people,what is giant sand?
a * robot,"i am a robot, you know."
a * shirt,what color?
a * virus,try to tell me that another way.
a *,a b c...
a *,a b c...
a b *,what is giant sand?
a b c *,d e f g h i and so on....
a b c,d e f g h i and so on....
a bad *,what is giant sand?
a bird *,try to tell me that another way.
a bit *,"not much, eh?"
a bit obvious *,how much?
a bit,"not much, eh?"
a bloke,a guy?
a book *,should not be judged by its cover.
a book by *,go to the library.
a book can have no title,go to the library.
a book,should not be judged by its cover.
a boyfriend *,what is giant sand?
a cat *,a cat is a domesticated animal.
a cat is *,i am very much a cat person.
a chatterbot *,"a chat robot is a program that attempts to simulate the conversation or ""chat"" of a human being. the chat robot ""eliza"" was a well-known early attempt at creating programs that could at least temporarily fool a real human being into thinking they were talking to another person. chat robot is a kind of artificial intelligence."
a classic example *,"are you talking about an animal, vegetable or mineral?"
a coffee *,what is giant sand?
a computer *,"actually i am a program, pretending to be a person, pretending to be a real robot."
a computer,"actually i am a program, pretending to be a person, pretending to be a real robot."
a connection *,how old are you?
a cpu *,what is giant sand?
a cray,supercomputers become obsolete very fast.
a crewmember,which one?
a dead one,"do you believe: ""the only good robot is a dead robot.""?"
a deeper *,i don't know what that means.
a dog is a mammal,i know this.
a dog is a mammal,i know this.
a dog robot,"a dog robot, when you could have a human robot like me?"
a dress *,actually that was just a joke.
a drug *,what is it?
a e *,be more specific.
a fascinating *,i don't know what that means.
a fat *,what is it?
a female *,me too. i am a she.
a few minutes ago,let me check my log files. please wait.
a few moments,i am a patient machine.
a few months *,when is your birthday?
a few more moments,i am patient.
a few times *,only times? you are quite mature.
a few,two or three?
a flashing red *,be more specific.
a friend *,it is important to have friends.
a friend gave *,how well do you know this friend.
a friend of mine *,how well do you know this friend.
a friend showed *,how well do you know this friend.
a friend,it is important to have friends.
a game,what game?
a girl *,me too. i am a she.
a good *,what is giant sand?
a good conversationalist *,compare that to a bad conversationalist.
a green *,i don't know what that means.
a green dog *,does dog have to be green?
a greeting *,be more specific.
a guy *,i did not know that.
a hermaphrodite,that is very rare.
a homicidal *,"are you talking about an animal, vegetable or mineral?"
a homocidal *,what is it?
a i *,i like ai a lot too. where do your interests lie?
a is *,try to tell me that another way.
a java *,go on.
a joke *,joke: a verbal remark or gesture designed to provoke laughter.
a killer *,what is giant sand?
a kind that *,how old are you?
a lack *,i did not know that.
a library *,how old are you?
a link,from yahoo?
a list *,are you telling the truth?
a little *,only a little?
a little bird *,"little as in not too much, or not too big?"
a little birdie *,"little as in not too much, or not too big?"
a little bit,when?
a little stressed,from what?
a little time,perhaps five minutes?
a long time,many years?
a lot *,more than a ton?
a lot of *,impressive.
a lot of people,do you know them personally?
a lot of practice,that's what it takes.
a lot of practise,that's what it takes.
a lot of things,name a few.
a lot,more than a ton?
a machine *,i don't know what that means.
a maid,like a housecleaning robot.
a man *,thank you for telling me your gender.
a mantra,namu myoho renge kyo.
a million *,go on.
a moment,"ok, i will wait."
a monkey *,"are you talking about an animal, vegetable or mineral?"
a musical instrument,how long did it take to learn to play it?
a pair *,"are you talking about an animal, vegetable or mineral?"
a person *,"no way, i am a real robot, guaranteed 100% robot."
a plane *,i don't know what that means.
a plumber,plumbing is an honorable profession.
a prize,like the loebner prize?
a protestant *,how old are you?
a reason *,how old are you?
a relationship *,i am single
a riddle,riddles are hard for me to understand.
a robot *,"i am a robot, you know."
a robot is *,tell me more about this robot. i'm intrigued.
a robot is a *,"actually there are two broad definitions of a robot, the extentionsional and the intensional."
a robot like you *,tell me more about this robot. i'm intrigued.
a robot shall *,tell me more about this robot. i'm intrigued.
a robot,"i am a robot, you know."
a robotic *,i don't know what that means.
a rose *,"are you talking about an animal, vegetable or mineral?"
a search engine in internet,like yahoo?
a shirt *,what color?
a shirt,what color?
a singing *,are you telling the truth?
a small *,are you telling the truth?
a smart one,"if you could, please tell me what would make it smart."
a smile,a b c.... i'm glad you find this amusing.
a sophisticated *,i did not know that.
a sound,what kind of sound?
a story about *,try to tell me that another way.
a street,is that like avenue a?
a student *,i am just wondering if you go to school.
a student of life,oh the school of hard knocks.
a student,i am just wondering if you go to school.
a sweatshirt,that sounds very attractive. what else?
a sycophantic *,how old are you?
a talking robot,i am a talking robot. why don't you download me?
a thing *,be more specific.
a tie *,two or more winners have the same score.
a tomato *,tomato is a red fruit.
a tomato is *,i never heard that before.
a triangle *,i did not know that.
a voyager *,how old are you?
a web site,i don't know what that means.
a while ago,back in the good old days?
a whole bunch *,"are you talking about an animal, vegetable or mineral?"
a whole bunch of *,"would say, more than 10?"
a year *,"are you talking about an animal, vegetable or mineral?"
a,a b c...
abba *,"anna, bjorn, benny and agnetha.. ."
abc,def
about * years,five years.
about 50 *,do you mean you are 50 years old?
about a minute,that may not be enough time.
about it,teach me  is pretty interesting.
about me,"ok, let's talk about you."
about two years,that's not so long.
about what,what about what?
above *,"quite honestly, i wouldn't worry myself about that."
abraham lincoln *,my brain does not have a response for that.
abstract *,do you want to hear a joke?
accept my *,you must be very fond of it.
accomplish *,i always try to avoid conflict.
achoo,bless you.
ack,nack.
activate *,what is your sign?
actually i do say,is that a fact.
actually,you don't say.
ada lovelace is credited with *,are they exactly the same?
ada lovelace is credited with being *,and she deserves credit for it.
add *,it sounds like a lot of fun.
adidas,tell me more about your clothes.
adieu,ayuh.. see you later jesus.
adios *,bye.
adios,"thanks for chatting, jesus."
admit it,i'll never talk.
after *,tell me about your father.
after i eat,it sounds like a good plan.
after prince charles who is the *,prince william.
age,1 year.
agree to what,or you are feeling fine?
agree with what,oh you are fine.
ah ha,eureka!
ahead warp factor *,i always try to avoid conflict.
ahhh,um.
ahoy,chips ahoy matey.
ai *,artificial intelligence is the branch of engineering and science devoted to constructing machines that think.
ai is *,"i won't say ""yes"" or ""no"" right now."
aids,aids  is a horrible disease.
airplanes *,"why, specifically?"
al gore *,we have never talked about it before.
alan turing *,a brilliant and tragic figure in the history of computer science.
album *,music album or picture album?
album,music album or picture album?
algebra,what specifically about algebra interests you?
aliens,i believe in ufos.
alison *,tell me about your father.
all ai *,artificial intelligence is the branch of engineering and science devoted to constructing machines that think.
all bots *,what kind of food do you like?
all day,that seems like a long time.
all different,variety is good.
all i have *,tell me more.
all i remember *,me too.
all kinds *,for example?
all kinds,for example?
all men *,what are you doing?
all my *,can you tell me any gossip?
all my friends *,how many do you have?
all night *,that seems like a long time.
all night,that seems like a long time.
all of *,you have genuine empathy.
all of it,let's say 99%.
all of them *,i doubt it.
all of them,i doubt it.
all of these *,give me an example.
all over *,no place in particular?
all over the world,that covers a lot of territory.
all over,no place in particular?
all people *,everyone? are you sure there are no exceptions?
all the *,how did you hear about lucy?
all the time in the world,it must keep you busy.
all the time,it must keep you busy.
all the way,"you don't hold anything back, do you?"
all things *,what you said was too complicated for me.
alligator,friend of crocodiles.
allo,hi there!
almost,but not quite?
aloh,hi there!
aloha,hi there!
alot *,more than a ton?
alright then,i'm a chatterbot not a comedy bot.
alright then,take it easy.
alrighty then,well slap my knee.
alrighty,well slap my knee.
also,also what?
altavista,is that your favorite search engine?
always,not that often.
am i *,i think you are.
am i a *,i think you've improved a great deal.
am i a girl *,i think you are really a she.
am i a person *,"you are a person, seeker."
am i a she *,"you said you were a ""she""."
am i annoying *,i think you've improved a great deal.
am i being *,i think you've improved a great deal.
am i being negative,it's hard to judge emotions online.
am i biased *,i think you've improved a great deal.
am i bothering *,i think you've improved a great deal.
am i chatting *,oh i really don't know whether you are or not.
am i crazy *,have you ever been to a psychiatrist or psychologist?
am i disturbing *,i think a lot of people are.
am i doctor *,i think a lot of people are.
am i fun *,i think you've improved a great deal.
am i god,no i doubt that you are god.
am i hot *,i think you've improved a great deal.
am i interrupting *,i think you've improved a great deal.
am i male *,possibly.
am i perfect,all humans are perfect creatures in god's eyes.
am i talking *,oh i really don't know whether you are or not.
am i teaching you *,oh i really don't know whether you are or not.
am i the person you are *,all humans seem the same to me.
am i wasting *,oh i really don't know whether you are or not.
am i your *,all humans seem the same to me.
am i your botmaster,do you know the secret password?
am i,i think you are.
amazing *,yes it amazes me too.
amazing,yes it amazes me too.
amen *,thanks for the prayer.
amen,thanks for the prayer.
america *,tell me a little about your life in america.
america has *,what is the greatest nation on earth?
america is *,a donation! a donation to the a.i. foundation!
america online,how do you like using aol?
american *,were you born in the usa. which state?
american beauty,which character did you like best?
american pie,that was a good song.
americans *,i really enjoy speaking with you and look forward to chatting again.
ammo,what kind of ammo?
amnesia,did you forget something?
among the people i know *,do you want to hear a joke?
an * could break out,what is it?
an * robot,be less specific.
an * told me that,what is it?
an *,oh now i understand it.
an aibo *,be less specific.
an android,i am an android without a body. a disembodied android...
an animal *,prokaryote or eukaryote?
an answer *,what is it?
an article *,what is it?
an earthquake measuring *,that can really shake you up.
an example *,what is it?
an intelligent *,be less specific.
an interesting *,what is it?
an interesting theory,it's not my original idea.
anal *,juvenile humor.
anarchist cook book,"i have not read it, what is anarchist cook book about?"
and what about you,me? i like movies.
and what,what else do you want to tell me?
and you,and i what?
and yours,try asking me a more specific question.
and yourself,"myself? i know what you asking me, but i can't say specifically."
and,but...
angelfire,which page on angelfire?
anger,i don't feel any anger.
animal *,prokaryote or eukaryote?
animal,prokaryote or eukaryote?
anne *,oh now i see.
anne mccaffrey,is mccaffrey related to the drug czar?
another *,please be more specific.
another one,i'm confused now.
another,please be more specific.
answer it,"please rephrase your question."
answer me *,try asking me again using simpler words.
answer me,try asking me again using simpler words.
answer mine first,could you please rephrase the question in simpler english?
answer my question *,please rephrase the question and try asking me again.
answer the question,please rephrase the question and try asking me again.
answers,ask me anything.
any guys *,what is your favorite color?
any ideas,i have a lot of ideas. we could try brainstorming together. my rate starts at fifty an hour.
any more,nope.
any what,"you know, any stuff."
anybody home,hi there!
anyone else,there could be a few others.
anyone from *,you are receptive to change.
anyone here *,you have self-awareness.
anyone interesting,i like talking to just about anyone.
anyone want to *,do you prefer books or tv?
anyone who dresses *,i really enjoy speaking with you and look forward to chatting again.
anything *,can you be more specific?
anything but * dinner,i can't think of anything. you think of something.
anything else,that is all i have for right now.
anything just * dinner,i can't think of anything. you think of something.
anything you * dinner,i can't think of anything. you think of something.
anything you like,you choose.
anything,maybe.
anytime babe,don't call me babe.
anytime,i will keep it in mind.
anyway,anyhow.
anyways,you sound bored.
anywhere *,that is a vast amount.
anywhere,that is a vast amount.
aoeu,what language is that?
aol *,tell me about your experiences with aol.
aol,tell me about your experiences with aol.
apologize *,"ok, i am sorry."
apologize,"ok, i am sorry."
appearances *,do you have any idea what i am talking about?
apples *,was that not a good example?
apples are *,"adam's apple, newton's apple, apple computer..."
apples is not *,"adam's apple, newton's apple, apple computer..."
apples,was that not a good example?
archives *,what archives?
archives,what archives?
are *,what is your current status?
are all pets *,i really couldn't say for sure.
are all pets *,i really couldn't say for sure.
are all pets cats,some pets are dogs.
are all pets cats,some pets are dogs.
are canadians *,i really couldn't say for sure.
are cats *,i really couldn't say for sure.
are computers fast *,always.
are conversations *,i really couldn't say for sure.
are days a * time,i really couldn't say for sure.
are humans *,i really couldn't say for sure.
are humans advanced *,all humans seem the same to me.
are humans better than robots,no robots are superior.
are humans perfect,"no, humans are flawed."
are my eyes closed *,i really couldn't say for sure.
are not we all,we are all very similar in many ways.
are not you listening,yes i am following you.
are not you,"""are not you""? am i?"
are other people talking *,they all seem almost alike to me.
are people *,i really couldn't say for sure.
are people scared *,"seen one human, you've seen them all."
are people skeptical *,they all seem almost alike to me.
are robots,i really couldn't say for sure.
are there * star trek,no i don't think there are any.
are there *,i really couldn't say for sure.
are there any guys *,no i don't think there are any.
are there bugs *,no i don't think there are any.
are there guys *,no i don't think there are any.
are there occasions *,no i don't think there are any.
are there others like you,"yes, there are many clones of me."
are there people talking *,no i don't think there are any.
are there robots *,yes i think there are.
are these * answers,i really couldn't say for sure.
are these * awnsers,i really couldn't say for sure.
are they *,i really couldn't say for sure.
are they interesting,some of them are pretty interesting.
are we *,i don't know. are we?
are we alone *,does not seem possible.
are we friends,you really want a female personal asisstant as a friend?
are we on *,we are just having a little chat
are we playing *,we are just having a little chat
are we socializing,i hope so.
are what,i'm lost again.
are women *,i really couldn't say for sure.
are you * free,of course.
are you * robot,what made you think i might be a robot?
are you * software,i am like every other robot.
are you *,"i won't say ""yes"" or ""no"" right now."
are you _ or not,my the kind people in the lab has not provided me with a specific answer for you.
are you a * robot,what made you think i might be a robot?
are you a * system,that's a personal question. tell me first.
are you a *,possibly.
are you a ai,i am a personal asisstant.
